Hotel Pueblo Indalo, Paseo del Mediterráneo 10,Mojácar,Almería,500,100,4,0,0,1
Hotel Marina de la Torre, Paseo del Mediterráneo 166,Mojácar,Almería,800,4,0,0,1
Vera Playa club hotel, Avenida Ciudad de Barcelona s/n,Vera,Almería,200,3,0,0,1
Hotel Best Oasis Tropical, Paseo del mar 1, Mojácar, Almería,700,5,0,0,1
El Cercado, A-4130 km 26, Bérchules, Granada,30,5,1,1,1
Hotel Finca Los Llanos, Calle Sierra Nevada, Capileira, Granada,16,4,1,1,1
Hotel Real de Laroles, Calle Real de Laroles 46, Laroles - Nevada, Granada,12,4,1,1,1
Calerilla Hotel, Carretera de la sierra 23A, Cazorla, Jaén,20,5,1,1,1
